{
  "version": 1,
  "generatedAt": "2026-09-02T14:28:57.625Z",
  "failures": [],
  "candidates": [
    {
      "candidateId": "candidate-rockstar-youtube-0b4b414ff3149da6",
      "detectedAt": "2026-08-31T20:28:19.776Z",
      "publishedAt": "2026-08-28T01:01:30.000Z",
      "title": "Grand Theft Auto VI: An Extended Look — Now Playing",
      "summary": "#GrandTheftAutoVI #GTAVI",
      "statusSuggested": "CONFIRMED",
      "confidenceSuggested": 1,
      "categorySuggested": "News",
      "source": {
        "sourceId": "rockstar-youtube",
        "sourceName": "Rockstar Games — YouTube",
        "sourceTier": 100,
        "sourceUrlRaw": "https://www.youtube.com/shorts/MJOrsRRa9GM",
        "sourceUrlCanonical": "https://www.youtube.com/shorts/MJOrsRRa9GM",
        "externalId": "yt:video:MJOrsRRa9GM",
        "platform": "YOUTUBE",
        "imageUrlRaw": "https://www.youtube.com/v/MJOrsRRa9GM?version=3",
        "imageUrlCanonical": "https://www.youtube.com/v/MJOrsRRa9GM?version=3"
      },
      "contentHash": "96f1f5c39a2c7d813fa01bc287c8a417c152a36055f80fe24c9a717a5cf8867d",
      "reviewState": "APPROVED",
      "reviewReason": "Approved and published by scheduled editorial policy; merged into the existing topic.",
      "canonicalNewsId": "gta6-legacy-rockstar-youtube-b6d01fcf5819db63",
      "reviewHistory": [
        {
          "state": "PENDING",
          "reason": null,
          "timestamp": "2026-08-31T20:28:19.776Z"
        },
        {
          "state": "APPROVED",
          "reason": "Approved and published by scheduled editorial policy; merged into the existing topic.",
          "timestamp": "2026-09-01T16:13:19.222Z"
        }
      ]
    },
    {
      "candidateId": "candidate-rockstar-youtube-33cffcfba79cf440",
      "detectedAt": "2026-08-31T20:28:19.776Z",
      "publishedAt": "2026-08-28T01:01:28.000Z",
      "title": "Grand Theft Auto VI: An Extended Look — Now Playing",
      "summary": "#GrandTheftAutoVI #GTAVI",
      "statusSuggested": "CONFIRMED",
      "confidenceSuggested": 1,
      "categorySuggested": "News",
      "source": {
        "sourceId": "rockstar-youtube",
        "sourceName": "Rockstar Games — YouTube",
        "sourceTier": 100,
        "sourceUrlRaw": "https://www.youtube.com/shorts/53C6gUqRpK4",
        "sourceUrlCanonical": "https://www.youtube.com/shorts/53C6gUqRpK4",
        "externalId": "yt:video:53C6gUqRpK4",
        "platform": "YOUTUBE",
        "imageUrlRaw": "https://www.youtube.com/v/53C6gUqRpK4?version=3",
        "imageUrlCanonical": "https://www.youtube.com/v/53C6gUqRpK4?version=3"
      },
      "contentHash": "21d189632c3896110402e18b348328e41d2f92f2fd1f4282fdd73d400f6e2e34",
      "reviewState": "APPROVED",
      "reviewReason": "Approved and published by scheduled editorial policy; merged into the existing topic.",
      "canonicalNewsId": "gta6-legacy-rockstar-youtube-b6d01fcf5819db63",
      "reviewHistory": [
        {
          "state": "PENDING",
          "reason": null,
          "timestamp": "2026-08-31T20:28:19.776Z"
        },
        {
          "state": "APPROVED",
          "reason": "Approved and published by scheduled editorial policy; merged into the existing topic.",
          "timestamp": "2026-09-01T16:13:19.178Z"
        }
      ]
    },
    {
      "candidateId": "candidate-rockstar-youtube-4e0403bd89b60f10",
      "detectedAt": "2026-08-31T20:28:19.776Z",
      "publishedAt": "2026-08-28T01:01:24.000Z",
      "title": "Grand Theft Auto VI: An Extended Look — Now Playing",
      "summary": "#GrandTheftAutoVI #GTAVI",
      "statusSuggested": "CONFIRMED",
      "confidenceSuggested": 1,
      "categorySuggested": "News",
      "source": {
        "sourceId": "rockstar-youtube",
        "sourceName": "Rockstar Games — YouTube",
        "sourceTier": 100,
        "sourceUrlRaw": "https://www.youtube.com/shorts/mAfR_ybf5WM",
        "sourceUrlCanonical": "https://www.youtube.com/shorts/mAfR_ybf5WM",
        "externalId": "yt:video:mAfR_ybf5WM",
        "platform": "YOUTUBE",
        "imageUrlRaw": "https://www.youtube.com/v/mAfR_ybf5WM?version=3",
        "imageUrlCanonical": "https://www.youtube.com/v/mAfR_ybf5WM?version=3"
      },
      "contentHash": "c5cb06c8a18ce09d76681021167f289be138f386ea784ad9cd050646bcf39c8e",
      "reviewState": "APPROVED",
      "reviewReason": "Approved and published by scheduled editorial policy; merged into the existing topic.",
      "canonicalNewsId": "gta6-legacy-rockstar-youtube-b6d01fcf5819db63",
      "reviewHistory": [
        {
          "state": "PENDING",
          "reason": null,
          "timestamp": "2026-08-31T20:28:19.776Z"
        },
        {
          "state": "APPROVED",
          "reason": "Approved and published by scheduled editorial policy; merged into the existing topic.",
          "timestamp": "2026-09-01T20:42:12.099Z"
        }
      ]
    },
    {
      "candidateId": "candidate-rockstar-youtube-3eccc44c326f8997",
      "detectedAt": "2026-08-31T20:28:19.776Z",
      "publishedAt": "2026-08-28T01:01:21.000Z",
      "title": "Grand Theft Auto VI: An Extended Look — Now Playing",
      "summary": "#GrandTheftAutoVI #GTAVI",
      "statusSuggested": "CONFIRMED",
      "confidenceSuggested": 1,
      "categorySuggested": "News",
      "source": {
        "sourceId": "rockstar-youtube",
        "sourceName": "Rockstar Games — YouTube",
        "sourceTier": 100,
        "sourceUrlRaw": "https://www.youtube.com/shorts/L-9NI3mHZVo",
        "sourceUrlCanonical": "https://www.youtube.com/shorts/L-9NI3mHZVo",
        "externalId": "yt:video:L-9NI3mHZVo",
        "platform": "YOUTUBE",
        "imageUrlRaw": "https://www.youtube.com/v/L-9NI3mHZVo?version=3",
        "imageUrlCanonical": "https://www.youtube.com/v/L-9NI3mHZVo?version=3"
      },
      "contentHash": "296b9094f4dd53c5e0e0cac236ba31047ff3acdd3fabefde0d4a218eb1f0e255",
      "reviewState": "APPROVED",
      "reviewReason": "Approved and published by scheduled editorial policy; merged into the existing topic.",
      "canonicalNewsId": "gta6-legacy-rockstar-youtube-b6d01fcf5819db63",
      "reviewHistory": [
        {
          "state": "PENDING",
          "reason": null,
          "timestamp": "2026-08-31T20:28:19.776Z"
        },
        {
          "state": "APPROVED",
          "reason": "Approved and published by scheduled editorial policy; merged into the existing topic.",
          "timestamp": "2026-09-01T20:42:12.053Z"
        }
      ]
    },
    {
      "candidateId": "candidate-rockstar-youtube-2982b9ed686ff84d",
      "detectedAt": "2026-08-31T20:28:19.776Z",
      "publishedAt": "2026-08-28T01:01:18.000Z",
      "title": "Grand Theft Auto VI: An Extended Look — Now Playing",
      "summary": "#GrandTheftAutoVI #GTAVI",
      "statusSuggested": "CONFIRMED",
      "confidenceSuggested": 1,
      "categorySuggested": "News",
      "source": {
        "sourceId": "rockstar-youtube",
        "sourceName": "Rockstar Games — YouTube",
        "sourceTier": 100,
        "sourceUrlRaw": "https://www.youtube.com/shorts/GVTE_MuInQg",
        "sourceUrlCanonical": "https://www.youtube.com/shorts/GVTE_MuInQg",
        "externalId": "yt:video:GVTE_MuInQg",
        "platform": "YOUTUBE",
        "imageUrlRaw": "https://www.youtube.com/v/GVTE_MuInQg?version=3",
        "imageUrlCanonical": "https://www.youtube.com/v/GVTE_MuInQg?version=3"
      },
      "contentHash": "fadd491ad68b93708bbd6b119149337487cd659826a1ad1712e18dc512c3e5e4",
      "reviewState": "APPROVED",
      "reviewReason": "Approved and published by scheduled editorial policy; merged into the existing topic.",
      "canonicalNewsId": "gta6-legacy-rockstar-youtube-b6d01fcf5819db63",
      "reviewHistory": [
        {
          "state": "PENDING",
          "reason": null,
          "timestamp": "2026-08-31T20:28:19.776Z"
        },
        {
          "state": "APPROVED",
          "reason": "Approved and published by scheduled editorial policy; merged into the existing topic.",
          "timestamp": "2026-09-01T20:42:12.009Z"
        }
      ]
    },
    {
      "candidateId": "candidate-rockstar-youtube-67716fad78c23bb9",
      "detectedAt": "2026-08-31T20:28:19.776Z",
      "publishedAt": "2026-08-28T01:01:15.000Z",
      "title": "Grand Theft Auto VI: An Extended Look — Now Playing",
      "summary": "#GrandTheftAutoVI #GTAVI",
      "statusSuggested": "CONFIRMED",
      "confidenceSuggested": 1,
      "categorySuggested": "News",
      "source": {
        "sourceId": "rockstar-youtube",
        "sourceName": "Rockstar Games — YouTube",
        "sourceTier": 100,
        "sourceUrlRaw": "https://www.youtube.com/shorts/Xzxv75FjMJk",
        "sourceUrlCanonical": "https://www.youtube.com/shorts/Xzxv75FjMJk",
        "externalId": "yt:video:Xzxv75FjMJk",
        "platform": "YOUTUBE",
        "imageUrlRaw": "https://www.youtube.com/v/Xzxv75FjMJk?version=3",
        "imageUrlCanonical": "https://www.youtube.com/v/Xzxv75FjMJk?version=3"
      },
      "contentHash": "fe7fad80086876dcc5b960146be93c7e39d92b590890895a836af8f44eb9e818",
      "reviewState": "APPROVED",
      "reviewReason": "Approved and published by scheduled editorial policy; merged into the existing topic.",
      "canonicalNewsId": "gta6-legacy-rockstar-youtube-b6d01fcf5819db63",
      "reviewHistory": [
        {
          "state": "PENDING",
          "reason": null,
          "timestamp": "2026-08-31T20:28:19.776Z"
        },
        {
          "state": "APPROVED",
          "reason": "Approved and published by scheduled editorial policy; merged into the existing topic.",
          "timestamp": "2026-09-01T20:42:11.965Z"
        }
      ]
    },
    {
      "candidateId": "candidate-rockstar-youtube-95e04c5b689c56e9",
      "detectedAt": "2026-08-31T20:28:19.776Z",
      "publishedAt": "2026-08-28T01:00:48.000Z",
      "title": "Grand Theft Auto VI: An Extended Look",